{
  "escaneo_id": "ESC-C1-2026-10-26-003",
  "tipo_documento": "liberacion",
  "planta_id": "C1",
  "fecha": "2026-10-26",
  "orden_id": "ORD-2026-0042",
  "rollo_id": "R-017",
  "lote": "US-TYV-88213",
  "responsable": "marta",
  "resultado": "pendiente",
  "firma_presente": false,
  "paginas": 2,
  "legibilidad": "alta",
  "idioma": "es",
  "archivo_id": "ARCH-0051"
}
